{
  "team_name": "Mumbai Indians",
  "team_abbrev": "MI",
  "home_venue": "Wankhede Stadium",
  "venue_bias": "pace",
  "captain": "Hardik Pandya",
  "wicketkeeper": "Quinton de Kock",
  "xi": [
    {
      "batting_position": 1,
      "player_id": "372455c4",
      "player_name": "Quinton de Kock",
      "role": "Wicketkeeper",
      "batting_hand": "Left-hand",
      "is_overseas": true,
      "price_cr": 1.0,
      "rationale": "Founder's Selection"
    },
    {
      "batting_position": 2,
      "player_id": "740742ef",
      "player_name": "Rohit Sharma",
      "role": "Batter",
      "batting_hand": "Right-hand",
      "is_overseas": false,
      "price_cr": 16.3,
      "rationale": "Founder's Selection"
    },
    {
      "batting_position": 3,
      "player_id": "b0482a1d",
      "player_name": "Tilak Varma",
      "role": "Batter",
      "batting_hand": "Left-hand",
      "is_overseas": false,
      "price_cr": 8.0,
      "rationale": "Founder's Selection"
    },
    {
      "batting_position": 4,
      "player_id": "271f83cd",
      "player_name": "Suryakumar Yadav",
      "role": "Batter",
      "batting_hand": "Right-hand",
      "is_overseas": false,
      "price_cr": 16.35,
      "rationale": "Founder's Selection"
    },
    {
      "batting_position": 5,
      "player_id": "dbe50b21",
      "player_name": "Hardik Pandya",
      "role": "All-rounder",
      "batting_hand": "Right-hand",
      "is_overseas": false,
      "price_cr": 16.35,
      "rationale": "Founder's Selection"
    },
    {
      "batting_position": 6,
      "player_id": "d014d5ac",
      "player_name": "Sherfane Rutherford",
      "role": "All-rounder",
      "batting_hand": "Left-hand",
      "is_overseas": true,
      "price_cr": 2.6,
      "rationale": "Founder's Selection"
    },
    {
      "batting_position": 7,
      "player_id": "fffa744b",
      "player_name": "Naman Dhir",
      "role": "All-rounder",
      "batting_hand": "Right-hand",
      "is_overseas": false,
      "price_cr": 5.25,
      "rationale": "Founder's Selection"
    },
    {
      "batting_position": 8,
      "player_id": "e4a0deae",
      "player_name": "Mitchell Santner",
      "role": "All-rounder",
      "batting_hand": "Left-hand",
      "is_overseas": true,
      "price_cr": 2.0,
      "rationale": "Founder's Selection"
    },
    {
      "batting_position": 9,
      "player_id": "23eeb873",
      "player_name": "Deepak Chahar",
      "role": "Pace Bowler",
      "batting_hand": "Right-hand",
      "is_overseas": false,
      "price_cr": 9.25,
      "rationale": "Founder's Selection"
    },
    {
      "batting_position": 10,
      "player_id": "a818c1be",
      "player_name": "Trent Boult",
      "role": "Pace Bowler",
      "batting_hand": "Right-hand",
      "is_overseas": true,
      "price_cr": 12.5,
      "rationale": "Founder's Selection"
    },
    {
      "batting_position": 11,
      "player_id": "462411b3",
      "player_name": "Jasprit Bumrah",
      "role": "Pace Bowler",
      "batting_hand": "Right-hand",
      "is_overseas": false,
      "price_cr": 18.0,
      "rationale": "Founder's Selection"
    }
  ],
  "impact_player": {
    "player_id": "a9fd84fb",
    "player_name": "Mayank Markande",
    "role": "Spinner",
    "batting_hand": "Right-hand",
    "is_overseas": false,
    "price_cr": 0.3,
    "rationale": "Founder's Selection"
  },
  "balance": {
    "overseas_count": 4,
    "bowling_options": 9,
    "spinners": 5,
    "pacers": 6,
    "left_handers_top6": 3
  },
  "constraints_satisfied": true,
  "constraint_violations": [],
  "generation_notes": [
    "Founder Override \u2014 11 XI + impact"
  ]
}
