{
  "team_name": "Lucknow Super Giants",
  "team_abbrev": "LSG",
  "home_venue": "Ekana Cricket Stadium",
  "venue_bias": "neutral",
  "captain": "Rishabh Pant",
  "wicketkeeper": "Nicholas Pooran",
  "xi": [
    {
      "batting_position": 1,
      "player_id": "3d8feaf8",
      "player_name": "Mitchell Marsh",
      "role": "All-rounder",
      "batting_hand": "Right-hand",
      "is_overseas": true,
      "price_cr": 3.4,
      "rationale": "Founder's Selection"
    },
    {
      "batting_position": 2,
      "player_id": "6a26221c",
      "player_name": "Aiden Markram",
      "role": "All-rounder",
      "batting_hand": "Right-hand",
      "is_overseas": true,
      "price_cr": 2.0,
      "rationale": "Founder's Selection"
    },
    {
      "batting_position": 3,
      "player_id": "3241e3fd",
      "player_name": "Nicholas Pooran",
      "role": "Wicketkeeper",
      "batting_hand": "Left-hand",
      "is_overseas": true,
      "price_cr": 21.0,
      "rationale": "Founder's Selection"
    },
    {
      "batting_position": 4,
      "player_id": "919a3be2",
      "player_name": "Rishabh Pant",
      "role": "Wicketkeeper",
      "batting_hand": "Left-hand",
      "is_overseas": false,
      "price_cr": 27.0,
      "rationale": "Founder's Selection"
    },
    {
      "batting_position": 6,
      "player_id": "872b03f7",
      "player_name": "Ayush Badoni",
      "role": "All-rounder",
      "batting_hand": "Right-hand",
      "is_overseas": false,
      "price_cr": 4.0,
      "rationale": "Founder's Selection"
    },
    {
      "batting_position": 7,
      "player_id": "8e514b4c",
      "player_name": "Abdul Samad",
      "role": "All-rounder",
      "batting_hand": "Right-hand",
      "is_overseas": false,
      "price_cr": 4.2,
      "rationale": "Founder's Selection"
    },
    {
      "batting_position": 8,
      "player_id": "f9e6e7ef",
      "player_name": "Shahbaz Ahmed",
      "role": "All-rounder",
      "batting_hand": "Left-hand",
      "is_overseas": false,
      "price_cr": 2.4,
      "rationale": "Founder's Selection"
    },
    {
      "batting_position": 9,
      "player_id": "eef2536f",
      "player_name": "Avesh Khan",
      "role": "Pace Bowler",
      "batting_hand": "Right-hand",
      "is_overseas": false,
      "price_cr": 9.75,
      "rationale": "Founder's Selection"
    },
    {
      "batting_position": 10,
      "player_id": "8cf9814c",
      "player_name": "Mohammed Shami",
      "role": "Pace Bowler",
      "batting_hand": "Right-hand",
      "is_overseas": false,
      "price_cr": 10.0,
      "rationale": "Founder's Selection"
    },
    {
      "batting_position": 11,
      "player_id": "13fc5c6d",
      "player_name": "Digvesh Rathi",
      "role": "Spinner",
      "batting_hand": "Right-hand",
      "is_overseas": false,
      "price_cr": 0.3,
      "rationale": "Founder's Selection"
    }
  ],
  "impact_player": {
    "player_id": "founder_Mukul Choudhary",
    "player_name": "Mukul Choudhary",
    "role": "Wicketkeeper",
    "batting_hand": "Right-hand",
    "is_overseas": false,
    "price_cr": 0.0,
    "rationale": "Founder's Selection \u2014 Uncapped IPL, Middle-Order Batter"
  },
  "balance": {
    "overseas_count": 3,
    "bowling_options": 8,
    "spinners": 5,
    "pacers": 5,
    "left_handers_top6": 2
  },
  "constraints_satisfied": true,
  "constraint_violations": [],
  "generation_notes": [
    "Founder Override \u2014 10 XI + impact"
  ]
}
