{
  "team_name": "Rajasthan Royals",
  "team_abbrev": "RR",
  "home_venue": "Sawai Mansingh Stadium",
  "venue_bias": "neutral",
  "captain": "Riyan Parag",
  "wicketkeeper": "Dhruv Jurel",
  "xi": [
    {
      "batting_position": 1,
      "player_id": "6c19c6e5",
      "player_name": "Yashasvi Jaiswal",
      "role": "Batter",
      "batting_hand": "Left-hand",
      "is_overseas": false,
      "price_cr": 18.0,
      "rationale": "Founder's Selection"
    },
    {
      "batting_position": 2,
      "player_id": "470f446b",
      "player_name": "Vaibhav Sooryavanshi",
      "role": "Batter",
      "batting_hand": "Left-hand",
      "is_overseas": false,
      "price_cr": 1.1,
      "rationale": "Founder's Selection"
    },
    {
      "batting_position": 3,
      "player_id": "bcf325d2",
      "player_name": "Dhruv Jurel",
      "role": "Wicketkeeper",
      "batting_hand": "Right-hand",
      "is_overseas": false,
      "price_cr": 14.0,
      "rationale": "Founder's Selection"
    },
    {
      "batting_position": 4,
      "player_id": "04a418e8",
      "player_name": "Riyan Parag",
      "role": "All-rounder",
      "batting_hand": "Right-hand",
      "is_overseas": false,
      "price_cr": 14.0,
      "rationale": "Founder's Selection \u2014 Could also swap positions with Jurel."
    },
    {
      "batting_position": 5,
      "player_id": "e94915e6",
      "player_name": "Sam Curran",
      "role": "All-rounder",
      "batting_hand": "Left-hand",
      "is_overseas": true,
      "price_cr": 2.4,
      "rationale": "Founder's Selection"
    },
    {
      "batting_position": 6,
      "player_id": "48a1d7b7",
      "player_name": "Shimron Hetmyer",
      "role": "Batter",
      "batting_hand": "Left-hand",
      "is_overseas": true,
      "price_cr": 11.0,
      "rationale": "Founder's Selection"
    },
    {
      "batting_position": 7,
      "player_id": "fe93fd9d",
      "player_name": "Ravindra Jadeja",
      "role": "All-rounder",
      "batting_hand": "Left-hand",
      "is_overseas": false,
      "price_cr": 14.0,
      "rationale": "Founder's Selection"
    },
    {
      "batting_position": 8,
      "player_id": "5574750c",
      "player_name": "Jofra Archer",
      "role": "Pace Bowler",
      "batting_hand": "Right-hand",
      "is_overseas": true,
      "price_cr": 12.5,
      "rationale": "Founder's Selection"
    },
    {
      "batting_position": 9,
      "player_id": "df064e1a",
      "player_name": "Ravi Bishnoi",
      "role": "Spinner",
      "batting_hand": "Right-hand",
      "is_overseas": false,
      "price_cr": 7.2,
      "rationale": "Founder's Selection"
    },
    {
      "batting_position": 11,
      "player_id": "ce820073",
      "player_name": "Sandeep Sharma",
      "role": "Pace Bowler",
      "batting_hand": "Right-hand",
      "is_overseas": false,
      "price_cr": 4.0,
      "rationale": "Founder's Selection"
    }
  ],
  "impact_player": {
    "player_id": "f0af99a7",
    "player_name": "Donovan Ferreira",
    "role": "Wicketkeeper",
    "batting_hand": "Right-hand",
    "is_overseas": true,
    "price_cr": 1.0,
    "rationale": "Founder's Selection \u2014 Currently injured, might play in the IPL"
  },
  "balance": {
    "overseas_count": 3,
    "bowling_options": 8,
    "spinners": 5,
    "pacers": 5,
    "left_handers_top6": 4
  },
  "constraints_satisfied": true,
  "constraint_violations": [],
  "generation_notes": [
    "Founder Override \u2014 10 XI + impact"
  ]
}
